id,question_id,body,date_written,answerer_name,answerer_email,reported,helpful
1,13,"Some kind of recycled rubber, works great!",1615008233634,marcanthony,first.last@gmail.com,0,2
2,1,Something pretty soft but I can't be sure,1599990560555,metslover,first.last@gmail.com,0,5
3,1,Its the best! Seriously magic fabric,1614451524662,metslover,first.last@gmail.com,0,7
4,1,DONT BUY IT! It's bad for the environment,1600552162548,metslover,first.last@gmail.com,0,8
5,13,Rubber,1608391381140,Seller,first.last@gmail.com,0,7
6,14,China,1618481897469,Seller,first.last@gmail.com,0,8
7,17,"Runs small, I'd say",1599943428768,warmkid,first.last@gmail.com,0,9
8,18,I wouldn't machine wash it,1595613922158,dschulman,first.last@gmail.com,0,1